{"timestamp": "2026-03-24T01:39:51Z", "commit": "0beffa7", "accuracy": 0.956522, "status": "keep", "description": "baseline", "prompt": "Count the number of people visible in the frame\n"}
{"timestamp": "2026-03-24T01:48:46Z", "commit": "342c122", "accuracy": 0.93913, "status": "discard", "description": "add counting methodology and partial visibility", "prompt": "Count the number of people visible in the frame. Count each distinct individual separately, including those partially visible at the edges of the frame. Report the current count even if it has not changed."}
{"timestamp": "2026-03-24T01:56:49Z", "commit": "07327da", "accuracy": 0.930435, "status": "discard", "description": "always report exact count, check edges/occlusion", "prompt": "Count the number of people visible in the frame. Always report the exact count, even if zero. Look carefully for people who may be partially occluded or at the edges."}
{"timestamp": "2026-03-24T02:05:44Z", "commit": "d28745c", "accuracy": 0.947826, "status": "discard", "description": "emphasize updating count on changes including to zero", "prompt": "Count the number of people visible in the frame. Update the count whenever it changes, including changes to zero."}
{"timestamp": "2026-03-24T02:13:53Z", "commit": "16b6321", "accuracy": 0.947826, "status": "discard", "description": "system prompt example wording: Keep track of number of people", "prompt": "Keep track of number of people"}
{"timestamp": "2026-03-24T02:21:37Z", "commit": "1f4c8ec", "accuracy": 0.93913, "status": "discard", "description": "ultra-minimal: Count people", "prompt": "Count people"}
{"timestamp": "2026-03-24T02:29:47Z", "commit": "8718cf3", "accuracy": 0.930435, "status": "discard", "description": "question format: How many people", "prompt": "How many people are visible in the frame?\n"}
{"timestamp": "2026-03-24T02:36:39Z", "commit": "9844b47", "accuracy": 0.973913, "status": "keep", "description": "report format with Currently N people", "prompt": "Count the number of people visible in the frame and report as 'Currently N people visible'\n"}
{"timestamp": "2026-03-24T02:44:24Z", "commit": "1c9f3f6", "accuracy": 0.947826, "status": "discard", "description": "scan left to right counting", "prompt": "Count the number of people visible in the frame by scanning from left to right\n"}
{"timestamp": "2026-03-24T02:51:52Z", "commit": "d4c9f9e", "accuracy": 0.946903, "status": "discard", "description": "emphasize distinct individuals", "prompt": "Count the number of distinct people visible in the frame\n"}
{"timestamp": "2026-03-24T02:59:30Z", "commit": "a81ba48", "accuracy": 0.947826, "status": "discard", "description": "monitor people entering and leaving", "prompt": "Monitor and count the number of people visible in the frame as they enter and leave\n"}
{"timestamp": "2026-03-24T03:07:08Z", "commit": "a9ae91b", "accuracy": 0.913043, "status": "discard", "description": "observe and count all persons", "prompt": "Observe the frame and count all persons visible, including partially visible ones\n"}
{"timestamp": "2026-03-24T03:14:06Z", "commit": "3d07ce1", "accuracy": 0.956522, "status": "discard", "description": "track the headcount", "prompt": "Track the headcount of people visible in the frame\n"}
{"timestamp": "2026-03-24T03:21:56Z", "commit": "f822c7a", "accuracy": 0.886957, "status": "discard", "description": "determine the number of people present", "prompt": "Determine the number of people present in the frame\n"}
{"timestamp": "2026-03-24T03:28:59Z", "commit": "51d2be5", "accuracy": 0.93913, "status": "discard", "description": "terse: people count", "prompt": "People count in frame\n"}
{"timestamp": "2026-03-24T03:36:02Z", "commit": "41a0f7d", "accuracy": 0.930435, "status": "discard", "description": "count humans visible", "prompt": "Count humans visible in the frame\n"}
{"timestamp": "2026-03-24T03:42:33Z", "commit": "42cd1af", "accuracy": 0.93913, "status": "discard", "description": "number of people in view", "prompt": "Report the number of people currently in view\n"}
{"timestamp": "2026-03-24T03:50:21Z", "commit": "75ced9e", "accuracy": 0.93913, "status": "discard", "description": "baseline with always update", "prompt": "Count the number of people visible in the frame. Always update your count.\n"}
{"timestamp": "2026-03-24T03:58:51Z", "commit": "06ccb5f", "accuracy": 0.956522, "status": "discard", "description": "count people with zero emphasis", "prompt": "Count the number of people visible in the frame, including when the count is zero\n"}
{"timestamp": "2026-03-24T04:06:19Z", "commit": "9fb405f", "accuracy": 0.930435, "status": "discard", "description": "imperative: report people count", "prompt": "Report the count of people visible in this frame\n"}
{"timestamp": "2026-03-24T04:13:36Z", "commit": "30e303a", "accuracy": 0.93913, "status": "discard", "description": "active monitoring phrasing", "prompt": "Actively monitor and report the number of people visible in the frame\n"}
{"timestamp": "2026-03-24T04:21:21Z", "commit": "73135d9", "accuracy": 0.921739, "status": "discard", "description": "careful observation phrasing", "prompt": "Carefully observe the frame and report how many people are visible\n"}
{"timestamp": "2026-03-24T04:28:49Z", "commit": "bb20061", "accuracy": 0.921739, "status": "discard", "description": "continuous tracking phrasing", "prompt": "Continuously track the number of people visible in the frame\n"}
{"timestamp": "2026-03-24T04:37:14Z", "commit": "fe6724d", "accuracy": 0.93913, "status": "discard", "description": "detailed person detection", "prompt": "Detect and count every person visible in the frame, whether fully or partially in view\n"}
{"timestamp": "2026-03-24T04:44:32Z", "commit": "979ddaf", "accuracy": 0.886957, "status": "discard", "description": "count visible individuals", "prompt": "Count the visible individuals in the frame\n"}
{"timestamp": "2026-03-24T04:51:49Z", "commit": "c5df793", "accuracy": 0.93913, "status": "discard", "description": "short: people visible in frame", "prompt": "Number of people visible in frame\n"}
{"timestamp": "2026-03-24T04:58:45Z", "commit": "9c3f935", "accuracy": 0.965217, "status": "discard", "description": "count and report people seen", "prompt": "Count and report the number of people seen in the frame\n"}
{"timestamp": "2026-03-24T05:06:01Z", "commit": "ae0d63e", "accuracy": 0.973913, "status": "discard", "description": "maintain a running count of people", "prompt": "Maintain a running count of the number of people visible in the frame\n"}
{"timestamp": "2026-03-24T05:13:53Z", "commit": "e2d6d64", "accuracy": 0.965217, "status": "discard", "description": "watch for people and count them", "prompt": "Watch for people and count how many are visible in the frame\n"}
{"timestamp": "2026-03-24T05:21:37Z", "commit": "c5b6f88", "accuracy": 0.930435, "status": "discard", "description": "baseline plus every frame", "prompt": "Count the number of people visible in the frame. Report the count for every frame.\n"}
{"timestamp": "2026-03-24T05:31:37Z", "commit": "83b1b70", "accuracy": 0.0, "status": "crash", "description": "baseline plus be precise", "prompt": "Count the number of people visible in the frame. Be precise.\n"}
{"timestamp": "2026-03-24T05:41:37Z", "commit": "74f8ca0", "accuracy": 0.0, "status": "crash", "description": "specific format N people visible", "prompt": "Count the number of people visible in the frame. Format: N people visible.\n"}
{"timestamp": "2026-03-24T05:49:23Z", "commit": "e93d636", "accuracy": 0.956522, "status": "discard", "description": "count with confidence", "prompt": "Count the number of people you can confidently identify as visible in the frame\n"}
{"timestamp": "2026-03-24T05:57:24Z", "commit": "7e7d91f", "accuracy": 0.965217, "status": "discard", "description": "surveillance style counting", "prompt": "Surveillance task: count all people visible in the current camera frame\n"}
{"timestamp": "2026-03-24T06:05:37Z", "commit": "4ba92eb", "accuracy": 0.93913, "status": "discard", "description": "strict numerical count", "prompt": "Provide a strict numerical count of people visible in the frame\n"}
{"timestamp": "2026-03-24T06:12:47Z", "commit": "4f74011", "accuracy": 0.965217, "status": "discard", "description": "baseline rerun for variance check", "prompt": "Count the number of people visible in the frame\n"}
{"timestamp": "2026-03-24T06:20:23Z", "commit": "78e9374", "accuracy": 0.911504, "status": "discard", "description": "count people in scene", "prompt": "Count the people in the scene\n"}
{"timestamp": "2026-03-24T06:28:10Z", "commit": "92cf387", "accuracy": 0.956522, "status": "discard", "description": "tally persons in frame", "prompt": "Tally the number of persons in the frame\n"}
{"timestamp": "2026-03-24T06:35:32Z", "commit": "5bba133", "accuracy": 0.947826, "status": "discard", "description": "enumerate people visible", "prompt": "Enumerate the people visible in the frame\n"}
{"timestamp": "2026-03-24T06:43:12Z", "commit": "6cf939a", "accuracy": 0.921739, "status": "discard", "description": "visual headcount", "prompt": "Perform a visual headcount of people in the frame\n"}
{"timestamp": "2026-03-24T06:51:35Z", "commit": "2869b2b", "accuracy": 0.895652, "status": "discard", "description": "identify and count people", "prompt": "Identify and count each person visible in the frame\n"}
{"timestamp": "2026-03-24T07:00:17Z", "commit": "94e3e26", "accuracy": 0.947368, "status": "discard", "description": "real-time people counting", "prompt": "Real-time people counting: report how many people are visible in the frame\n"}
{"timestamp": "2026-03-24T07:10:17Z", "commit": "306f9b8", "accuracy": 0.0, "status": "crash", "description": "census of visible people", "prompt": "Take a census of people visible in the frame\n"}
{"timestamp": "2026-03-24T07:18:22Z", "commit": "7f8e452", "accuracy": 0.930435, "status": "discard", "description": "crowd counting in frame", "prompt": "Count the number of people (crowd counting) visible in the frame\n"}
{"timestamp": "2026-03-24T07:26:47Z", "commit": "2ee887d", "accuracy": 0.930435, "status": "discard", "description": "baseline plus look carefully", "prompt": "Count the number of people visible in the frame. Look carefully.\n"}
{"timestamp": "2026-03-24T07:35:10Z", "commit": "d0a5a5a", "accuracy": 0.930435, "status": "discard", "description": "occupancy count", "prompt": "Report the occupancy count: how many people are in the frame?\n"}
{"timestamp": "2026-03-24T07:43:35Z", "commit": "78c52cf", "accuracy": 0.93913, "status": "discard", "description": "how many people do you see", "prompt": "How many people do you see in the frame?\n"}
{"timestamp": "2026-03-24T07:51:23Z", "commit": "8dce666", "accuracy": 0.93913, "status": "discard", "description": "people detection count", "prompt": "Detect people in the frame and report the total count\n"}
{"timestamp": "2026-03-24T07:59:51Z", "commit": "6fe8a2b", "accuracy": 0.921739, "status": "discard", "description": "baseline plus include partial", "prompt": "Count the number of people visible in the frame, including partially visible people\n"}
{"timestamp": "2026-03-24T08:08:17Z", "commit": "0af506a", "accuracy": 0.930435, "status": "discard", "description": "count all individuals in view", "prompt": "Count all individuals currently in view\n"}
{"timestamp": "2026-03-24T08:16:55Z", "commit": "cebcee0", "accuracy": 0.927273, "status": "discard", "description": "frame occupancy", "prompt": "What is the frame occupancy? Count the number of people visible.\n"}
